{
  "contractVersion": 2,
  "kitRevision": "Z0104V40",
  "repositoryHead": "9e54b2fb3199c22f5d5c7cd67c8e4531ab2246f8",
  "upstreamCommit": "ce2ef77d7f96ac6325c1c8c3fe584b9caab418e4",
  "sharedCommit": "0c11f833f862661779180ea7da2a25fd515c40d8",
  "sharedGitlink": "0c11f833f862661779180ea7da2a25fd515c40d8",
  "pdfLocator": "scalinity/PiCar:picarx-companion/public/content/pdf/picar-x-assembly.pdf@9e54b2fb3199c22f5d5c7cd67c8e4531ab2246f8",
  "pdfGitBlob": "85c752c505c2a52bf82900111fd3a31c6ad0f9d8",
  "pdfSha256": {
    "state": "unavailable",
    "blockerIds": [
      "Q-02"
    ]
  },
  "pdfByteLength": 11048665,
  "status": "BLOCKED",
  "photoHashes": [
    {
      "evidenceId": "PX-EV-PHOTO-01",
      "sha256": "edc1cde83f080058a585fb1f7dfa4268825b293eeb93c7e4bda9a6394a1c9a23"
    },
    {
      "evidenceId": "PX-EV-PHOTO-02",
      "sha256": "c224983514db1b8c2094f22d001d4f3911eeab1facdbec1f3611f754a658e4dd"
    },
    {
      "evidenceId": "PX-EV-PHOTO-03",
      "sha256": "5aea1a7223ff50e5b3fc75854e4dd2d2e390ae7225d51212559a8f007e1ffc54"
    },
    {
      "evidenceId": "PX-EV-PHOTO-04",
      "sha256": "2d3a5383d2cd1e75c5c7e357ab242edcfd6ec38c3eeda062c600258cf67e5fdc"
    },
    {
      "evidenceId": "PX-EV-PHOTO-05",
      "sha256": "489723f408702e1b9e925e35c4f5658529afde0f16d9781dfcfbe72e83c0fc1d"
    },
    {
      "evidenceId": "PX-EV-PHOTO-06",
      "sha256": "a1e57eafca22306b98b2be384838a5a432913ecaff01cfd20d348ffe9dfb8063"
    }
  ],
  "panels": [],
  "blockerIds": [
    "Q-02"
  ]
}
